{
  "$schema": "https://json-schema.org/draft/2020-12/schema",
  "title": "audio-pipeline acoustic corpus manifest",
  "type": "object",
  "required": [
    "schema_version",
    "corpus_id",
    "revision",
    "cases"
  ],
  "properties": {
    "schema_version": {
      "const": 1
    },
    "corpus_id": {
      "type": "string",
      "minLength": 1
    },
    "revision": {
      "type": "string",
      "minLength": 1
    },
    "cases": {
      "type": "array",
      "minItems": 1,
      "items": {
        "type": "object",
        "required": [
          "case_id",
          "scenario"
        ],
        "properties": {
          "case_id": {
            "type": "string",
            "minLength": 1
          },
          "scenario": {
            "type": "string",
            "minLength": 1
          },
          "mic_angle_deg": {
            "type": "number"
          },
          "distance_m": {
            "type": "number",
            "minimum": 0
          },
          "snr_db": {
            "type": "number"
          },
          "ser_db": {
            "type": "number"
          },
          "motion": {
            "type": "string"
          },
          "noise": {
            "type": "string"
          },
          "echo_path_change": {
            "type": "boolean"
          }
        },
        "additionalProperties": true
      }
    }
  },
  "additionalProperties": false
}
